<?xml version="1.0" encoding="UTF-8"?>
<zo:zalba_na_odluku xmlns:xsi="http://www.w3.org/2001/XMLSchema-instance" 
xmlns:zo="http://www.ftn.uns.ac.rs/zalbanaodluku" 
xsi:schemaLocation="http://www.ftn.uns.ac.rs/zalbanaodluku zalbanaodlukucir.xsd ">
  <zo:naslov>zo:naslov</zo:naslov>
  <zo:podaci_o_povereniku>
    <zo:adresa>
      <zo:grad>zo:grad</zo:grad>
      <zo:ulica>zo:ulica</zo:ulica>
      <zo:broj>1</zo:broj>
    </zo:adresa>
    <zo:naziv_poverenika>zo:naziv_poverenika</zo:naziv_poverenika>
  </zo:podaci_o_povereniku>
  <zo:podaci_o_zalbi>
    <zo:naslov>zo:naslov</zo:naslov>
    <zo:podnosilac_zalbe>
      <zo:adresa>
        <zo:grad>zo:grad</zo:grad>
        <zo:ulica>zo:ulica</zo:ulica>
        <zo:broj>1</zo:broj>
      </zo:adresa>
      <zo:ime>zo:ime</zo:ime>
      <zo:prezime>zo:prezime</zo:prezime>
      <zo:potpis>zo:potpis</zo:potpis>
      <zo:drugi_podaci_za_kontakt>zo:drugi_podaci_za_kontakt</zo:drugi_podaci_za_kontakt>
    </zo:podnosilac_zalbe>
    <zo:organ_koji_je_doneo_odluku>
      <zo:adresa>
        <zo:grad>zo:grad</zo:grad>
        <zo:ulica>zo:ulica</zo:ulica>
        <zo:broj>1</zo:broj>
      </zo:adresa>
      <zo:naziv_poverenika>zo:naziv_poverenika</zo:naziv_poverenika>
    </zo:organ_koji_je_doneo_odluku>
    <zo:broj_zalbe>1</zo:broj_zalbe>
    <zo:datum>2001-01-01</zo:datum>
  </zo:podaci_o_zalbi>
  <zo:sadrzaj_zalbe>
    <zo:datum>2001-01-01</zo:datum>
    <zo:zbog_cega_se_pobija_odluka>zo:zbog_cega_se_pobija_odluka</zo:zbog_cega_se_pobija_odluka>
  </zo:sadrzaj_zalbe>
  <zo:podaci_o_podnosiocu_zalbe>
    <zo:adresa>
      <zo:grad>zo:grad</zo:grad>
      <zo:ulica>zo:ulica</zo:ulica>
      <zo:broj>1</zo:broj>
    </zo:adresa>
    <zo:ime>zo:ime</zo:ime>
    <zo:prezime>zo:prezime</zo:prezime>
    <zo:potpis>zo:potpis</zo:potpis>
    <zo:drugi_podaci_za_kontakt>zo:drugi_podaci_za_kontakt</zo:drugi_podaci_za_kontakt>
  </zo:podaci_o_podnosiocu_zalbe>
  <zo:podaci_o_mestu_i_datumu_podnosenja_zalbe>
    <zo:mesto>zo:mesto</zo:mesto>
    <zo:datum>2001-01-01</zo:datum>
  </zo:podaci_o_mestu_i_datumu_podnosenja_zalbe>
  <zo:napomena>
    <zo:tacka>zo:tacka</zo:tacka>
  </zo:napomena>
</zo:zalba_na_odluku>
